{
  "catalogVersion": "1.0.0-100000-test",
  "generatedAt": "2026-07-16T00:00:00.000Z",
  "records": [
    {
      "domain": "unknown",
      "raw": {
        "serialized": {
          "unresolvedEvidenceId": "strategy-bytes-unavailable"
        }
      },
      "recordId": "cfg-linked-evidence",
      "semanticStatus": "unresolved",
      "source": {
        "assetPath": "unavailable.asset",
        "bundle": "configfiles",
        "objectType": "MonoBehaviour"
      }
    }
  ],
  "releaseId": "test-release",
  "schemaVersion": "1.0.0",
  "source": {
    "kind": "fixture"
  }
}
